{
  "$schema" : "https://json-schema.org/draft/2020-12/schema",
  "$defs" : {
    "Map(String,String)" : {
      "type" : "object",
      "additionalProperties" : false
    }
  },
  "type" : "object",
  "properties" : {
    "description" : {
      "type" : "string"
    },
    "extras" : {
      "$ref" : "#/$defs/Map(String,String)"
    },
    "id" : {
      "type" : "string"
    },
    "name" : {
      "type" : "string"
    },
    "parentId" : {
      "type" : "string"
    },
    "type" : {
      "type" : "string"
    }
  },
  "additionalProperties" : false
}